{
  "prompt": "How long is an NFL game clock?",
  "unit": "minutes",
  "min": 30,
  "max": 120,
  "step": 5,
  "correctValue": 60,
  "tolerance": {
    "full": 5,
    "partial": 15
  },
  "explanation": {
    "correct": "Four 15-minute quarters. Real time is about three hours because the clock stops.",
    "incorrect": "Four 15-minute quarters make 60 minutes of game clock. The clock stops a lot."
  }
}
